[
  {
    "id": "impl.openai-python-sdk.execution.sdk_embedding",
    "harness_id": "openai-python-sdk",
    "capability_id": "execution.sdk_embedding",
    "status": "stable",
    "summary": "Typed Python access to the OpenAI API.",
    "actor_access": {
      "human_operator": "supported",
      "in_harness_agent": "unavailable",
      "external_orchestrator": "native",
      "ci_runner": "native",
      "administrator": "configurable"
    },
    "requires_human_mediation": false,
    "surfaces": [
      "Python library"
    ],
    "invocation": [],
    "minimum_version": null,
    "current_version_verified": "2.53.0",
    "limitations": [],
    "confidence": "verified_official",
    "verified_at": "2026-08-08T20:00:00Z",
    "evidence": [
      {
        "source_id": "src.openai-python.changelog",
        "url": "https://raw.githubusercontent.com/openai/openai-python/main/CHANGELOG.md",
        "claim": "Typed Python access to the OpenAI API.",
        "version": null,
        "verified_at": "2026-08-08T20:00:00Z"
      }
    ],
    "invocation_status": "unreviewed",
    "invocation_na_reason": null
  },
  {
    "id": "impl.openai-python-sdk.execution.structured_output",
    "harness_id": "openai-python-sdk",
    "capability_id": "execution.structured_output",
    "status": "stable",
    "summary": "Streaming and typed response objects support machine-readable application logic.",
    "actor_access": {
      "human_operator": "supported",
      "in_harness_agent": "unavailable",
      "external_orchestrator": "native",
      "ci_runner": "native",
      "administrator": "configurable"
    },
    "requires_human_mediation": false,
    "surfaces": [
      "streaming",
      "typed API objects"
    ],
    "invocation": [],
    "minimum_version": null,
    "current_version_verified": "2.53.0",
    "limitations": [],
    "confidence": "verified_official",
    "verified_at": "2026-08-08T20:00:00Z",
    "evidence": [
      {
        "source_id": "src.openai-python.changelog",
        "url": "https://raw.githubusercontent.com/openai/openai-python/main/CHANGELOG.md",
        "claim": "Streaming and typed response objects support machine-readable application logic.",
        "version": null,
        "verified_at": "2026-08-08T20:00:00Z"
      }
    ],
    "invocation_status": "unreviewed",
    "invocation_na_reason": null
  },
  {
    "id": "impl.openai-python-sdk.models.reasoning_control",
    "harness_id": "openai-python-sdk",
    "capability_id": "models.reasoning_control",
    "status": "stable",
    "summary": "Model and API feature parameters are exposed as generated typed interfaces.",
    "actor_access": {
      "human_operator": "supported",
      "in_harness_agent": "unavailable",
      "external_orchestrator": "native",
      "ci_runner": "native",
      "administrator": "configurable"
    },
    "requires_human_mediation": false,
    "surfaces": [
      "API parameters"
    ],
    "invocation": [],
    "minimum_version": null,
    "current_version_verified": "2.53.0",
    "limitations": [],
    "confidence": "verified_official",
    "verified_at": "2026-08-08T20:00:00Z",
    "evidence": [
      {
        "source_id": "src.openai-python.changelog",
        "url": "https://raw.githubusercontent.com/openai/openai-python/main/CHANGELOG.md",
        "claim": "Model and API feature parameters are exposed as generated typed interfaces.",
        "version": null,
        "verified_at": "2026-08-08T20:00:00Z"
      }
    ],
    "invocation_status": "unreviewed",
    "invocation_na_reason": null
  }
]
