[
  {
    "id": "impl.codex-sdk-python.execution.sdk_embedding",
    "harness_id": "codex-sdk-python",
    "capability_id": "execution.sdk_embedding",
    "status": "stable",
    "summary": "Python SDK controls the local Codex app-server over JSON-RPC and bundles a pinned runtime.",
    "actor_access": {
      "human_operator": "supported",
      "in_harness_agent": "unavailable",
      "external_orchestrator": "native",
      "ci_runner": "native",
      "administrator": "configurable"
    },
    "requires_human_mediation": false,
    "surfaces": [
      "Python library"
    ],
    "invocation": [],
    "minimum_version": null,
    "current_version_verified": "0.144.4",
    "limitations": [],
    "confidence": "verified_official",
    "verified_at": "2026-08-08T20:00:00Z",
    "evidence": [
      {
        "source_id": "src.codex.docs.sdk",
        "url": "https://developers.openai.com/codex/codex-sdk",
        "claim": "Python SDK controls the local Codex app-server over JSON-RPC and bundles a pinned runtime.",
        "version": null,
        "verified_at": "2026-08-08T20:00:00Z"
      }
    ],
    "invocation_status": "unreviewed",
    "invocation_na_reason": null
  },
  {
    "id": "impl.codex-sdk-python.execution.rpc_server",
    "harness_id": "codex-sdk-python",
    "capability_id": "execution.rpc_server",
    "status": "stable",
    "summary": "The SDK consumes Codex app-server JSON-RPC methods and version-specific schemas.",
    "actor_access": {
      "human_operator": "supported",
      "in_harness_agent": "unavailable",
      "external_orchestrator": "native",
      "ci_runner": "native",
      "administrator": "configurable"
    },
    "requires_human_mediation": false,
    "surfaces": [
      "JSON-RPC"
    ],
    "invocation": [],
    "minimum_version": null,
    "current_version_verified": "0.144.4",
    "limitations": [],
    "confidence": "verified_official",
    "verified_at": "2026-08-08T20:00:00Z",
    "evidence": [
      {
        "source_id": "src.codex.docs.app-server",
        "url": "https://developers.openai.com/codex/app-server",
        "claim": "The SDK consumes Codex app-server JSON-RPC methods and version-specific schemas.",
        "version": null,
        "verified_at": "2026-08-08T20:00:00Z"
      }
    ],
    "invocation_status": "unreviewed",
    "invocation_na_reason": null
  },
  {
    "id": "impl.codex-sdk-python.execution.structured_output",
    "harness_id": "codex-sdk-python",
    "capability_id": "execution.structured_output",
    "status": "stable",
    "summary": "Typed notifications and generated schemas expose machine-readable turn events.",
    "actor_access": {
      "human_operator": "supported",
      "in_harness_agent": "unavailable",
      "external_orchestrator": "native",
      "ci_runner": "native",
      "administrator": "configurable"
    },
    "requires_human_mediation": false,
    "surfaces": [
      "events",
      "JSON Schema"
    ],
    "invocation": [],
    "minimum_version": null,
    "current_version_verified": "0.144.4",
    "limitations": [],
    "confidence": "verified_official",
    "verified_at": "2026-08-08T20:00:00Z",
    "evidence": [
      {
        "source_id": "src.codex.docs.app-server",
        "url": "https://developers.openai.com/codex/app-server",
        "claim": "Typed notifications and generated schemas expose machine-readable turn events.",
        "version": null,
        "verified_at": "2026-08-08T20:00:00Z"
      }
    ],
    "invocation_status": "unreviewed",
    "invocation_na_reason": null
  },
  {
    "id": "impl.codex-sdk-python.sessions.resume_fork",
    "harness_id": "codex-sdk-python",
    "capability_id": "sessions.resume_fork",
    "status": "stable",
    "summary": "SDK clients control Codex threads and turns.",
    "actor_access": {
      "human_operator": "supported",
      "in_harness_agent": "unavailable",
      "external_orchestrator": "native",
      "ci_runner": "native",
      "administrator": "configurable"
    },
    "requires_human_mediation": false,
    "surfaces": [
      "threads"
    ],
    "invocation": [],
    "minimum_version": null,
    "current_version_verified": "0.144.4",
    "limitations": [],
    "confidence": "verified_official",
    "verified_at": "2026-08-08T20:00:00Z",
    "evidence": [
      {
        "source_id": "src.codex.docs.sdk",
        "url": "https://developers.openai.com/codex/codex-sdk",
        "claim": "SDK clients control Codex threads and turns.",
        "version": null,
        "verified_at": "2026-08-08T20:00:00Z"
      }
    ],
    "invocation_status": "unreviewed",
    "invocation_na_reason": null
  },
  {
    "id": "impl.codex-sdk-python.security.sandbox",
    "harness_id": "codex-sdk-python",
    "capability_id": "security.sandbox",
    "status": "stable",
    "summary": "Python SDK thread and turn calls expose Codex sandbox presets such as read-only and workspace-write.",
    "actor_access": {
      "human_operator": "supported",
      "in_harness_agent": "unavailable",
      "external_orchestrator": "native",
      "ci_runner": "native",
      "administrator": "configurable"
    },
    "requires_human_mediation": false,
    "surfaces": [
      "Python API",
      "sandbox presets"
    ],
    "invocation": [],
    "minimum_version": null,
    "current_version_verified": "0.144.4",
    "limitations": [],
    "confidence": "verified_official",
    "verified_at": "2026-08-08T20:00:00Z",
    "evidence": [
      {
        "source_id": "src.codex.docs.sdk",
        "url": "https://developers.openai.com/codex/codex-sdk",
        "claim": "Python SDK thread and turn calls expose Codex sandbox presets such as read-only and workspace-write.",
        "version": null,
        "verified_at": "2026-08-08T20:00:00Z"
      }
    ],
    "invocation_status": "unreviewed",
    "invocation_na_reason": null
  },
  {
    "id": "impl.codex-sdk-python.governance.human_approval_api",
    "harness_id": "codex-sdk-python",
    "capability_id": "governance.human_approval_api",
    "status": "stable",
    "summary": "SDK/app-server clients can participate in approval flows and return decisions through the machine protocol.",
    "actor_access": {
      "human_operator": "supported",
      "in_harness_agent": "unavailable",
      "external_orchestrator": "native",
      "ci_runner": "native",
      "administrator": "configurable"
    },
    "requires_human_mediation": false,
    "surfaces": [
      "JSON-RPC"
    ],
    "invocation": [],
    "minimum_version": null,
    "current_version_verified": "0.144.4",
    "limitations": [],
    "confidence": "verified_official",
    "verified_at": "2026-08-08T20:00:00Z",
    "evidence": [
      {
        "source_id": "src.codex.docs.app-server",
        "url": "https://developers.openai.com/codex/app-server",
        "claim": "SDK/app-server clients can participate in approval flows and return decisions through the machine protocol.",
        "version": null,
        "verified_at": "2026-08-08T20:00:00Z"
      }
    ],
    "invocation_status": "unreviewed",
    "invocation_na_reason": null
  }
]
